{
  "$schema": "json_schema/aws_awsomechat_app_config.schema.json",
  "appearance": {
    "type": "AWSomeChatAppearance",
    "parameters": {
      "name": "Finance Analyzer",
      "faviconUrl": "https://a0.awsstatic.com/libra-css/images/logos/aws_smile-header-desktop-en-white_59x35@2x.png"
    }
  },
  "amazonBedrock": [
    {
      "type": "AmazonBedrock",
      "parameters": {
        "region": "us-west-2"
      }
    }
  ],
  "llmConfig": {
    "parameters": {
      "anthropic\\.claude.*": {
        "type": "LLMConfig",
        "parameters": {
          "chatPrompt": "fin_analyzer/prompts/anthropic_claude_chat.yaml",
          "ragPrompt": "fin_analyzer/prompts/anthropic_claude_rag.yaml"
        }
      }
    },
    "type": "LLMConfigMap"
  },
  "finAnalyzer": {
    "type": "FinAnalyzer",
    "parameters": {
      "friendlyName": "Stock Analysis",
      "s3Bucket": "genie-ai-foundation-v2",
      "s3Prefix": "finance-analyzer"
    }
  }
}
